### ISSUE TITLE
One way transcode?

### ISSUE THREAD

**Issue by D4rk4** [sipwise/rtpengine#816]
Expected transcoding scheme:
192.168.4.3:5566/UDP<-opus->192.168.4.3:5060/UDP<>(KAMAILIO)<>192.168.4.3:5060<-G.711u->192.168.4.1:5060/UDP

What I'm got:
On leg to 192.168.4.1:5060 PCMU codec in all SIP messages - it's OK
On leg to 192.168.4.3:5566 PCMU codec offered by 192.168.4.1

Config:
`#!KAMAILIO
#!define SWITCH_IPADDRESS "192.168.4.1"
#!define FLAG_FROM_SWITCH 1
#!define FLAG_FROM_USER 2
#define WITH_DEBUG

#!ifdef WITH_DEBUG
debug=4
log_stderror=yes
#!else
debug=2
log_stderror=no
#!endif

memdbg=5
memlog=5

log_facility=LOG_LOCAL0
log_prefix="{$mt $hdr(CSeq) $ci} "

/* number of SIP routing processes */
children=8

/* uncomment the next line to disable TCP (default on) */
disable_tcp=yes

# ------------------ module loading ----------------------------------
loadmodule "tm.so"
loadmodule "rr.so"
loadmodule "pv.so"
loadmodule "sl.so"
loadmodule "maxfwd.so"
loadmodule "nathelper.so"
loadmodule "textops.so"
loadmodule "siputils.so"
loadmodule "xlog.so"
loadmodule "sanity.so"
loadmodule "path.so"
loadmodule "rtpengine.so"

# ----------------- setting module-specific parameters ---------------
modparam("nathelper|registrar", "received_avp", "$avp(s:rcv)")
modparam("rtpengine", "rtpengine_sock", "udp:localhost:12221")
# -------------------------  request routing logic -------------------
# main routing logic

route {

        # per request initial checks
        route(SANITY_CHECK);

        # CANCEL processing
        if (is_method("CANCEL")) {
                if (t_check_trans()) {
                        t_relay();
                }
                exit;
        }

        route(CHECK_SOURCE_IP);

        ##################################
        ### HANDLE SEQUENTIAL REQUESTS ###
        route(WITHINDLG);

        ###############################
        ### HANDLE INITIAL REQUESTS ###
        t_check_trans();

        if (is_method("INVITE|REFER")) {
                record_route();
        }

        if (is_method("REGISTER")) {
            add_path();
        }

        if (isflagset(FLAG_FROM_SWITCH)) {
                $du = "sip:192.168.4.3:5566";
        } else {
                $du = "sip:192.168.4.1:5060";
        }
### transcoding
        xlog("L_WARN", "Got stream from $si:$sp to $du");
        if (has_body("application/sdp")) {
                if ($sp == "5566") {
                        if ($mt == 1) {
                                xlog("L_WARN","Transcode TG2SIP leg");
                                rtpengine_offer("replace-origin replace-session-connection codec-mask-all codec-set-opus/48000/2 codec-transcode-PCMU/8000/1 ICE=remove");
                        } else {
                                rtpengine_manage("replace-origin replace-session-connection");
                        }
                } else {
                        if ($mt == 1) {
                                xlog("L_WARN","Transcode CUBE leg");
                                rtpengine_offer("replace-origin replace-session-connection codec-mask-all codec-transcode-opus/48000/2 ICE=remove");
                        } else {
                                rtpengine_manage("replace-origin replace-session-connection");
                        }
                }
        }
###
route(RELAY);
}

route[SANITY_CHECK]
{
        if (!sanity_check()) {
                xlog("L_WARN", "$ci|end|message is insane");
                exit;
        }

        if (!mf_process_maxfwd_header("10")) {
                xlog("L_WARN", "$ci|end|too much hops, not enough barley");
                send_reply("483", "Too Many Hops");
                exit;
        }

        if ($ua == "friendly-scanner" ||
                $ua == "sundayddr" ||
                $ua =~ "sipcli" ) {
                xlog("L_WARN", "$ci|end|dropping message with user-agent $ua");
                exit;
        }

}

route[CHECK_SOURCE_IP]
{
        if ($si == SWITCH_IPADDRESS) {
                setflag(FLAG_FROM_SWITCH);
        } else {
                setflag(FLAG_FROM_USER);
        }
}

# Handle requests within SIP dialogs
route[WITHINDLG]
{
        if (has_totag()) {
                # sequential request withing a dialog should
                # take the path determined by record-routing
                if (loose_route()) {
                        route(RELAY);
                } else {
                        if (is_method("NOTIFY")) {
                                route(RELAY);
                        }
                        if (is_method("SUBSCRIBE") && uri == myself) {
                                # in-dialog subscribe requests
                                exit;
                        }
                        if (is_method("ACK")) {
                                if (t_check_trans()) {
                                        # no loose-route, but stateful ACK;
                                        # must be an ACK after a 487
                                        # or e.g. 404 from upstream server
                                        t_relay();
                                        exit;
                                } else {
                                        # ACK without matching transaction ... ignore and discard
                                        #xlog("ACK without matching transaction ... ignore and discard");
                                        exit;
                                }
                        }
                        sl_send_reply("404","Not here");
                }
                exit;
        }
}

route[RELAY]
{
        if (!t_relay()) {
                sl_reply_error();
        }
        exit;
}
`

Dump from lo 5566/UDP:

`10:57:32.866575 IP 192.168.4.3.5566 > 192.168.4.3.5060: SIP: INVITE sip:1101@192.168.4.3:5060 SIP/2.0
..............E....j@.@..+...............UINVITE sip:1101@192.168.4.3:5060 SIP/2.0
Via: SIP/2.0/UDP 192.168.4.3:5566;rport;branch=z9hG4bKPjQ1P3IPWJbapkU4WYHeJyOYVuBme0-qS8
Max-Forwards: 70
From: sip:Telegram;tag=7H9HSpbj45O71KOwwy5qS6hfzwp.kMou
To: sip:1101@192.168.4.3
Contact: <sip:192.168.4.3:5566;ob>
Call-ID: gDus87.QuIoMz24iUSoUI.mfK3.UC70C
CSeq: 32270 INVITE
Allow: PRACK, INVITE, ACK, BYE, CANCEL, UPDATE, INFO, SUBSCRIBE, NOTIFY, REFER, MESSAGE, OPTIONS
Supported: replaces, 100rel, norefersub
X-GW-Context: 15160-203
X-TG-ID: 198315041
X-TG-FirstName: Dmitry
X-TG-Username: DmitryOligarch
X-TG-Phone: 79037004490
Content-Type: application/sdp
Content-Length:   345

v=0
o=- 3772771052 3772771052 IN IP4 192.168.4.3
s=pjmedia
b=AS:117
t=0 0
a=X-nat:0
m=audio 4150 RTP/AVP 120 96
c=IN IP4 192.168.4.3
b=TIAS:96000
a=rtcp:4151 IN IP4 192.168.4.3
a=sendrecv
a=rtpmap:120 opus/48000/2
a=fmtp:120 useinbandfec=1
a=rtpmap:96 telephone-event/8000
a=fmtp:96 0-16
a=ssrc:1206364267 cname:14bb76cc1e2803d4

10:57:32.882788 IP 192.168.4.3.5060 > 192.168.4.3.5566: SIP: SIP/2.0 100 trying -- your call is important to us
..............E....k..@...................SIP/2.0 100 trying -- your call is important to us
Via: SIP/2.0/UDP 192.168.4.3:5566;rport=5566;branch=z9hG4bKPjQ1P3IPWJbapkU4WYHeJyOYVuBme0-qS8;received=192.168.4.3
From: sip:Telegram;tag=7H9HSpbj45O71KOwwy5qS6hfzwp.kMou
To: sip:1101@192.168.4.3
Call-ID: gDus87.QuIoMz24iUSoUI.mfK3.UC70C
CSeq: 32270 INVITE
Server: kamailio (5.2.1 (x86_64/linux))
Content-Length: 0

10:57:33.387928 IP 192.168.4.3.5060 > 192.168.4.3.5566: SIP: SIP/2.0 180 Ringing
..............E.......@..................fSIP/2.0 180 Ringing
Via: SIP/2.0/UDP 192.168.4.3:5566;received=192.168.4.3;rport=5566;branch=z9hG4bKPjQ1P3IPWJbapkU4WYHeJyOYVuBme0-qS8
From: sip:Telegram;tag=7H9HSpbj45O71KOwwy5qS6hfzwp.kMou
To: sip:1101@192.168.4.3;tag=20170644-12
Date: Mon, 22 Jul 2019 07:57:32 GMT
Call-ID: gDus87.QuIoMz24iUSoUI.mfK3.UC70C
CSeq: 32270 INVITE
Require: 100rel
RSeq: 2547
Allow: INVITE, OPTIONS, BYE, CANCEL, ACK, PRACK, UPDATE, REFER, SUBSCRIBE, NOTIFY, INFO, REGISTER
Allow-Events: telephone-event
Remote-Party-ID: "Dmitry G." <sip:1101@192.168.4.1>;party=called;screen=yes;privacy=off
Contact: <sip:1101@192.168.4.1:5060>
Record-Route: <sip:192.168.4.3;lr;ftag=7H9HSpbj45O71KOwwy5qS6hfzwp.kMou>
Server: Cisco-SIPGateway/IOS-15.2.4.M11
Content-Length: 0

10:57:33.390375 IP 192.168.4.3.5566 > 192.168.4.3.5060: SIP: PRACK sip:1101@192.168.4.1:5060 SIP/2.0
..............E.....@.@...................PRACK sip:1101@192.168.4.1:5060 SIP/2.0
Via: SIP/2.0/UDP 192.168.4.3:5566;rport;branch=z9hG4bKPjQyfj5EXE7u4-PJiBDaVOIwrjTwMO1U14
Max-Forwards: 70
From: sip:Telegram;tag=7H9HSpbj45O71KOwwy5qS6hfzwp.kMou
To: sip:1101@192.168.4.3;tag=20170644-12
Call-ID: gDus87.QuIoMz24iUSoUI.mfK3.UC70C
CSeq: 32271 PRACK
Route: <sip:192.168.4.3;lr;ftag=7H9HSpbj45O71KOwwy5qS6hfzwp.kMou>
RAck: 2547 32270 INVITE
Content-Length:  0

10:57:33.402140 IP 192.168.4.3.5060 > 192.168.4.3.5566: SIP: SIP/2.0 200 OK
..............E.......@.."................SIP/2.0 200 OK
Via: SIP/2.0/UDP 192.168.4.3:5566;received=192.168.4.3;rport=5566;branch=z9hG4bKPjQyfj5EXE7u4-PJiBDaVOIwrjTwMO1U14
From: sip:Telegram;tag=7H9HSpbj45O71KOwwy5qS6hfzwp.kMou
To: sip:1101@192.168.4.3;tag=20170644-12
Date: Mon, 22 Jul 2019 07:57:33 GMT
Call-ID: gDus87.QuIoMz24iUSoUI.mfK3.UC70C
Server: Cisco-SIPGateway/IOS-15.2.4.M11
CSeq: 32271 PRACK
Content-Length: 0

10:57:36.922539 IP 192.168.4.3.5060 > 192.168.4.3.5566: SIP: SIP/2.0 200 OK
..............E..-. ..@..9................SIP/2.0 200 OK
Via: SIP/2.0/UDP 192.168.4.3:5566;received=192.168.4.3;rport=5566;branch=z9hG4bKPjQ1P3IPWJbapkU4WYHeJyOYVuBme0-qS8
From: sip:Telegram;tag=7H9HSpbj45O71KOwwy5qS6hfzwp.kMou
To: sip:1101@192.168.4.3;tag=20170644-12
Date: Mon, 22 Jul 2019 07:57:33 GMT
Call-ID: gDus87.QuIoMz24iUSoUI.mfK3.UC70C
CSeq: 32270 INVITE
Allow: INVITE, OPTIONS, BYE, CANCEL, ACK, PRACK, UPDATE, REFER, SUBSCRIBE, NOTIFY, INFO, REGISTER
Allow-Events: telephone-event
Remote-Party-ID: <sip:1101@192.168.4.1>;party=called;screen=yes;privacy=off
Contact: <sip:1101@192.168.4.1:5060>
Record-Route: <sip:192.168.4.3;lr;ftag=7H9HSpbj45O71KOwwy5qS6hfzwp.kMou>
Supported: replaces
Supported: sdp-anat
Server: Cisco-SIPGateway/IOS-15.2.4.M11
Supported: timer
Content-Type: application/sdp
Content-Disposition: session;handling=required
Content-Length: 188

v=0
o=CiscoSystemsSIP-GW-UserAgent 4859 7102 IN IP4 192.168.4.1
s=SIP Call
c=IN IP4 192.168.4.1
t=0 0
m=audio 16896 RTP/AVP 0
c=IN IP4 192.168.4.1
a=rtpmap:0 PCMU/8000
a=ptime:20

10:57:36.923651 IP 192.168.4.3.5566 > 192.168.4.3.5060: SIP: BYE sip:1101@192.168.4.1:5060 SIP/2.0
..............E....!@.@...................BYE sip:1101@192.168.4.1:5060 SIP/2.0
Via: SIP/2.0/UDP 192.168.4.3:5566;rport;branch=z9hG4bKPjKzEnugAJWR7sc2rxsBUjFdRLJ0tU4KNA
Max-Forwards: 70
From: sip:Telegram;tag=7H9HSpbj45O71KOwwy5qS6hfzwp.kMou
To: sip:1101@192.168.4.3;tag=20170644-12
Call-ID: gDus87.QuIoMz24iUSoUI.mfK3.UC70C
CSeq: 32272 BYE
Route: <sip:192.168.4.3;lr;ftag=7H9HSpbj45O71KOwwy5qS6hfzwp.kMou>
Content-Length:  0

10:57:36.923875 IP 192.168.4.3.5566 > 192.168.4.3.5060: SIP: ACK sip:1101@192.168.4.1:5060 SIP/2.0
..............E...."@.@...................ACK sip:1101@192.168.4.1:5060 SIP/2.0
Via: SIP/2.0/UDP 192.168.4.3:5566;rport;branch=z9hG4bKPjJhRbCjGg1mqod7f.qIXqlNPHKCfCgJms
Max-Forwards: 70
From: sip:Telegram;tag=7H9HSpbj45O71KOwwy5qS6hfzwp.kMou
To: sip:1101@192.168.4.3;tag=20170644-12
Call-ID: gDus87.QuIoMz24iUSoUI.mfK3.UC70C
CSeq: 32270 ACK
Route: <sip:192.168.4.3;lr;ftag=7H9HSpbj45O71KOwwy5qS6hfzwp.kMou>
Content-Length:  0

10:57:36.932205 IP 192.168.4.3.5060 > 192.168.4.3.5566: SIP: SIP/2.0 200 OK
..............E....#..@..t...............CSIP/2.0 200 OK
Via: SIP/2.0/UDP 192.168.4.3:5566;received=192.168.4.3;rport=5566;branch=z9hG4bKPjKzEnugAJWR7sc2rxsBUjFdRLJ0tU4KNA
From: sip:Telegram;tag=7H9HSpbj45O71KOwwy5qS6hfzwp.kMou
To: sip:1101@192.168.4.3;tag=20170644-12
Date: Mon, 22 Jul 2019 07:57:36 GMT
Call-ID: gDus87.QuIoMz24iUSoUI.mfK3.UC70C
Server: Cisco-SIPGateway/IOS-15.2.4.M11
CSeq: 32272 BYE
Reason: Q.850;cause=16
P-RTP-Stat: PS=0,OS=0,PR=0,OR=0,PL=0,JI=0,LA=0,DU=0
Content-Length: 0
`

**Comment by rfuchs** [comment]
The debug log from rtpengine itself would be most helpful here, but if I had to guess, since you're mentioning a branched call, is that you need to use the `via-branch=` option to tell rtpengine that this is indeed a branched call.

**Comment by D4rk4** [comment]
Here is output from rtpengine:
```
июл 22 16:55:54 helper rtpengine[31765]: DEBUG: Adding a proxy for control ng stats:127.0.0.1
июл 22 16:55:54 helper rtpengine[31765]: INFO: [mTtyL5GKHtFzlLMsd-7-fwGsh7HZ8P7b]: Received command 'offer' from 127.0.0.1:55992
июл 22 16:55:54 helper rtpengine[31765]: DEBUG: [mTtyL5GKHtFzlLMsd-7-fwGsh7HZ8P7b]: Dump for 'offer' from 127.0.0.1:55992: { "sdp": "v=0
июл 22 16:55:54 helper rtpengine[31765]: o=- 3772792554 3772792554 IN IP4 192.168.4.3
июл 22 16:55:54 helper rtpengine[31765]: s=pjmedia
июл 22 16:55:54 helper rtpengine[31765]: b=AS:117
июл 22 16:55:54 helper rtpengine[31765]: t=0 0
июл 22 16:55:54 helper rtpengine[31765]: a=X-nat:0
июл 22 16:55:54 helper rtpengine[31765]: m=audio 4156 RTP/AVP 120 96
июл 22 16:55:54 helper rtpengine[31765]: c=IN IP4 192.168.4.3
июл 22 16:55:54 helper rtpengine[31765]: b=TIAS:96000
июл 22 16:55:54 helper rtpengine[31765]: a=rtcp:4157 IN IP4 192.168.4.3
июл 22 16:55:54 helper rtpengine[31765]: a=sendrecv
июл 22 16:55:54 helper rtpengine[31765]: a=rtpmap:120 opus/48000/2
июл 22 16:55:54 helper rtpengine[31765]: a=fmtp:120 useinbandfec=1
июл 22 16:55:54 helper rtpengine[31765]: a=rtpmap:96 telephone-event/8000
июл 22 16:55:54 helper rtpengine[31765]: a=fmtp:96 0-16
июл 22 16:55:54 helper rtpengine[31765]: a=ssrc:519075951 cname:5be33f373cc9ce72
июл 22 16:55:54 helper rtpengine[31765]: ", "ICE": "remove", "flags": [ "codec-set-opus/48000/2" ], "replace": [ "origin", "session-connection" ], "codec": { "mask": [ "all" ], "transcode": [ "PCMU/8000/1" ] }, "call-id": "mTtyL5GKHtFzlLMsd-7-fwGsh7HZ8P7b", "received-from": [ "IP4", "192.168.4.3" ], "from-tag": "JZCGoTnkP3-WL1qh0aoYGrGKstrsArSw", "command": "offer" }
июл 22 16:55:54 helper rtpengine[31765]: NOTICE: [mTtyL5GKHtFzlLMsd-7-fwGsh7HZ8P7b]: Creating new call
июл 22 16:55:54 helper rtpengine[31765]: DEBUG: [mTtyL5GKHtFzlLMsd-7-fwGsh7HZ8P7b]: Using default bitrate of 32000 bps for 2-channel Opus
июл 22 16:55:54 helper rtpengine[31765]: DEBUG: [mTtyL5GKHtFzlLMsd-7-fwGsh7HZ8P7b]: Codec 'PCMU/8000' added for transcoding with payload type 0
июл 22 16:55:54 helper rtpengine[31765]: DEBUG: [mTtyL5GKHtFzlLMsd-7-fwGsh7HZ8P7b]: Default sink codec is opus/48000/2
июл 22 16:55:54 helper rtpengine[31765]: DEBUG: [mTtyL5GKHtFzlLMsd-7-fwGsh7HZ8P7b]: 0 DTMF sink entries
июл 22 16:55:54 helper rtpengine[31765]: DEBUG: [mTtyL5GKHtFzlLMsd-7-fwGsh7HZ8P7b]: Creating codec handler for PCMU/8000
июл 22 16:55:54 helper rtpengine[31765]: DEBUG: [mTtyL5GKHtFzlLMsd-7-fwGsh7HZ8P7b]: Sink does not support codec PCMU/8000
июл 22 16:55:54 helper rtpengine[31765]: DEBUG: [mTtyL5GKHtFzlLMsd-7-fwGsh7HZ8P7b]: Created transcode context for PCMU/8000 -> opus/48000/2 with DTMF output -1
июл 22 16:55:54 helper rtpengine[31765]: DEBUG: [mTtyL5GKHtFzlLMsd-7-fwGsh7HZ8P7b]: Creating SSRC transcoder from PCMU/8000/1 to opus/48000/2
июл 22 16:55:54 helper rtpengine[31765]: DEBUG: [mTtyL5GKHtFzlLMsd-7-fwGsh7HZ8P7b]: Initialized encoder with frame size 960 samples
июл 22 16:55:54 helper rtpengine[31765]: DEBUG: [mTtyL5GKHtFzlLMsd-7-fwGsh7HZ8P7b]: Encoder created with clockrate 48000, 2 channels, using sample format 1 (ptime 20 for 960 samples per frame and 960 samples (0 bytes) per packet, bitrate 32000)
июл 22 16:55:54 helper rtpengine[31765]: INFO: [mTtyL5GKHtFzlLMsd-7-fwGsh7HZ8P7b]: Enabling transcoding engine
июл 22 16:55:54 helper rtpengine[31765]: DEBUG: [mTtyL5GKHtFzlLMsd-7-fwGsh7HZ8P7b]: creating send_timer
июл 22 16:55:54 helper rtpengine[31765]: DEBUG: [mTtyL5GKHtFzlLMsd-7-fwGsh7HZ8P7b]: set FILLED flag for stream 192.168.4.3:4156
июл 22 16:55:54 helper rtpengine[31765]: DEBUG: [mTtyL5GKHtFzlLMsd-7-fwGsh7HZ8P7b]: set FILLED flag for stream 192.168.4.3:4157
июл 22 16:55:54 helper rtpengine[31765]: INFO: [mTtyL5GKHtFzlLMsd-7-fwGsh7HZ8P7b]: Replying to 'offer' from 127.0.0.1:55992 (elapsed time 0.005671 sec)
июл 22 16:55:54 helper rtpengine[31765]: DEBUG: [mTtyL5GKHtFzlLMsd-7-fwGsh7HZ8P7b]: Response dump for 'offer' to 127.0.0.1:55992: { "sdp": "v=0
июл 22 16:55:54 helper rtpengine[31765]: o=- 3772792554 3772792554 IN IP4 192.168.4.3
июл 22 16:55:54 helper rtpengine[31765]: s=pjmedia
июл 22 16:55:54 helper rtpengine[31765]: b=AS:117
июл 22 16:55:54 helper rtpengine[31765]: t=0 0
июл 22 16:55:54 helper rtpengine[31765]: a=X-nat:0
июл 22 16:55:54 helper rtpengine[31765]: m=audio 30000 RTP/AVP 0
июл 22 16:55:54 helper rtpengine[31765]: c=IN IP4 192.168.4.3
июл 22 16:55:54 helper rtpengine[31765]: b=TIAS:96000
июл 22 16:55:54 helper rtpengine[31765]: a=ssrc:519075951 cname:5be33f373cc9ce72
июл 22 16:55:54 helper rtpengine[31765]: a=rtpmap:0 PCMU/8000
июл 22 16:55:54 helper rtpengine[31765]: a=sendrecv
июл 22 16:55:54 helper rtpengine[31765]: a=rtcp:30001
июл 22 16:55:54 helper rtpengine[31765]: ", "result": "ok" }
июл 22 16:55:55 helper rtpengine[31765]: DEBUG: timer run time = 0.000190 sec
```

**Comment by D4rk4** [comment]
Here is output from rtpengine:
```
июл 22 16:55:54 helper rtpengine[31765]: DEBUG: Adding a proxy for control ng stats:127.0.0.1
июл 22 16:55:54 helper rtpengine[31765]: INFO: [mTtyL5GKHtFzlLMsd-7-fwGsh7HZ8P7b]: Received command 'offer' from 127.0.0.1:55992
июл 22 16:55:54 helper rtpengine[31765]: DEBUG: [mTtyL5GKHtFzlLMsd-7-fwGsh7HZ8P7b]: Dump for 'offer' from 127.0.0.1:55992: { "sdp": "v=0
июл 22 16:55:54 helper rtpengine[31765]: o=- 3772792554 3772792554 IN IP4 192.168.4.3
июл 22 16:55:54 helper rtpengine[31765]: s=pjmedia
июл 22 16:55:54 helper rtpengine[31765]: b=AS:117
июл 22 16:55:54 helper rtpengine[31765]: t=0 0
июл 22 16:55:54 helper rtpengine[31765]: a=X-nat:0
июл 22 16:55:54 helper rtpengine[31765]: m=audio 4156 RTP/AVP 120 96
июл 22 16:55:54 helper rtpengine[31765]: c=IN IP4 192.168.4.3
июл 22 16:55:54 helper rtpengine[31765]: b=TIAS:96000
июл 22 16:55:54 helper rtpengine[31765]: a=rtcp:4157 IN IP4 192.168.4.3
июл 22 16:55:54 helper rtpengine[31765]: a=sendrecv
июл 22 16:55:54 helper rtpengine[31765]: a=rtpmap:120 opus/48000/2
июл 22 16:55:54 helper rtpengine[31765]: a=fmtp:120 useinbandfec=1
июл 22 16:55:54 helper rtpengine[31765]: a=rtpmap:96 telephone-event/8000
июл 22 16:55:54 helper rtpengine[31765]: a=fmtp:96 0-16
июл 22 16:55:54 helper rtpengine[31765]: a=ssrc:519075951 cname:5be33f373cc9ce72
июл 22 16:55:54 helper rtpengine[31765]: ", "ICE": "remove", "flags": [ "codec-set-opus/48000/2" ], "replace": [ "origin", "session-connection" ], "codec": { "mask": [ "all" ], "transcode": [ "PCMU/8000/1" ] }, "call-id": "mTtyL5GKHtFzlLMsd-7-fwGsh7HZ8P7b", "received-from": [ "IP4", "192.168.4.3" ], "from-tag": "JZCGoTnkP3-WL1qh0aoYGrGKstrsArSw", "command": "offer" }
июл 22 16:55:54 helper rtpengine[31765]: NOTICE: [mTtyL5GKHtFzlLMsd-7-fwGsh7HZ8P7b]: Creating new call
июл 22 16:55:54 helper rtpengine[31765]: DEBUG: [mTtyL5GKHtFzlLMsd-7-fwGsh7HZ8P7b]: Using default bitrate of 32000 bps for 2-channel Opus
июл 22 16:55:54 helper rtpengine[31765]: DEBUG: [mTtyL5GKHtFzlLMsd-7-fwGsh7HZ8P7b]: Codec 'PCMU/8000' added for transcoding with payload type 0
июл 22 16:55:54 helper rtpengine[31765]: DEBUG: [mTtyL5GKHtFzlLMsd-7-fwGsh7HZ8P7b]: Default sink codec is opus/48000/2
июл 22 16:55:54 helper rtpengine[31765]: DEBUG: [mTtyL5GKHtFzlLMsd-7-fwGsh7HZ8P7b]: 0 DTMF sink entries
июл 22 16:55:54 helper rtpengine[31765]: DEBUG: [mTtyL5GKHtFzlLMsd-7-fwGsh7HZ8P7b]: Creating codec handler for PCMU/8000
июл 22 16:55:54 helper rtpengine[31765]: DEBUG: [mTtyL5GKHtFzlLMsd-7-fwGsh7HZ8P7b]: Sink does not support codec PCMU/8000
июл 22 16:55:54 helper rtpengine[31765]: DEBUG: [mTtyL5GKHtFzlLMsd-7-fwGsh7HZ8P7b]: Created transcode context for PCMU/8000 -> opus/48000/2 with DTMF output -1
июл 22 16:55:54 helper rtpengine[31765]: DEBUG: [mTtyL5GKHtFzlLMsd-7-fwGsh7HZ8P7b]: Creating SSRC transcoder from PCMU/8000/1 to opus/48000/2
июл 22 16:55:54 helper rtpengine[31765]: DEBUG: [mTtyL5GKHtFzlLMsd-7-fwGsh7HZ8P7b]: Initialized encoder with frame size 960 samples
июл 22 16:55:54 helper rtpengine[31765]: DEBUG: [mTtyL5GKHtFzlLMsd-7-fwGsh7HZ8P7b]: Encoder created with clockrate 48000, 2 channels, using sample format 1 (ptime 20 for 960 samples per frame and 960 samples (0 bytes) per packet, bitrate 32000)
июл 22 16:55:54 helper rtpengine[31765]: INFO: [mTtyL5GKHtFzlLMsd-7-fwGsh7HZ8P7b]: Enabling transcoding engine
июл 22 16:55:54 helper rtpengine[31765]: DEBUG: [mTtyL5GKHtFzlLMsd-7-fwGsh7HZ8P7b]: creating send_timer
июл 22 16:55:54 helper rtpengine[31765]: DEBUG: [mTtyL5GKHtFzlLMsd-7-fwGsh7HZ8P7b]: set FILLED flag for stream 192.168.4.3:4156
июл 22 16:55:54 helper rtpengine[31765]: DEBUG: [mTtyL5GKHtFzlLMsd-7-fwGsh7HZ8P7b]: set FILLED flag for stream 192.168.4.3:4157
июл 22 16:55:54 helper rtpengine[31765]: INFO: [mTtyL5GKHtFzlLMsd-7-fwGsh7HZ8P7b]: Replying to 'offer' from 127.0.0.1:55992 (elapsed time 0.005671 sec)
июл 22 16:55:54 helper rtpengine[31765]: DEBUG: [mTtyL5GKHtFzlLMsd-7-fwGsh7HZ8P7b]: Response dump for 'offer' to 127.0.0.1:55992: { "sdp": "v=0
июл 22 16:55:54 helper rtpengine[31765]: o=- 3772792554 3772792554 IN IP4 192.168.4.3
июл 22 16:55:54 helper rtpengine[31765]: s=pjmedia
июл 22 16:55:54 helper rtpengine[31765]: b=AS:117
июл 22 16:55:54 helper rtpengine[31765]: t=0 0
июл 22 16:55:54 helper rtpengine[31765]: a=X-nat:0
июл 22 16:55:54 helper rtpengine[31765]: m=audio 30000 RTP/AVP 0
июл 22 16:55:54 helper rtpengine[31765]: c=IN IP4 192.168.4.3
июл 22 16:55:54 helper rtpengine[31765]: b=TIAS:96000
июл 22 16:55:54 helper rtpengine[31765]: a=ssrc:519075951 cname:5be33f373cc9ce72
июл 22 16:55:54 helper rtpengine[31765]: a=rtpmap:0 PCMU/8000
июл 22 16:55:54 helper rtpengine[31765]: a=sendrecv
июл 22 16:55:54 helper rtpengine[31765]: a=rtcp:30001
июл 22 16:55:54 helper rtpengine[31765]: ", "result": "ok" }
июл 22 16:55:55 helper rtpengine[31765]: DEBUG: timer run time = 0.000190 sec
```

**Comment by rfuchs** [comment]
That's only a single offer. There's more to a call than just that (I hope)

**Comment by D4rk4** [comment]
When I'm answer to this call. Call is dropped on 192.168.4.3:5566  side I see codec mismatch. It's happened because 192.168.4.1:5060 (Cisco) offer PCMU codec, but on 192.168.4.3:5060 only Opus supported.
```
v=0
o=CiscoSystemsSIP-GW-UserAgent 4859 7102 IN IP4 192.168.4.1
s=SIP Call
c=IN IP4 192.168.4.1
t=0 0
m=audio 16896 RTP/AVP 0
c=IN IP4 192.168.4.1
a=rtpmap:0 PCMU/8000
a=ptime:20
```
I can't find way, how to configure rtmpengine to handle it.

**Comment by rfuchs** [comment]
But there is a second branch? So there should be a second offer.

**Comment by D4rk4** [comment]
it's offer proxied by Kamailio from 192.168.4.1:5060 without any changes of SDP

**Comment by rfuchs** [comment]
I don't think I understand the problem then. The incoming SDP has Opus listed and the outgoing SDP has PCMU listed. So if that offer is going to your PCMU endpoint and it rejects it, then there's something else going on that's not rtpengine's doing.

**Comment by D4rk4** [comment]
One endpoint (192.168.4.1) can work only with PCMU, another one (192.168.4.3:5566) can work only with Opus codec.
When I try make call from any endpoints I see this situation:
When SIP messages goes troth RTPEngine/Kamailio proxy from 192.168.4.3 all working fine: I see only PCMU in SIP messages. But when messages goes from 192.168.4.1 side. Kamailo (or RTPEngine) don't do anything with SIP SDP and I'm see "a=rtpmap:0 PCMU/8000" in codecs negotiation on 192.168.4.3:5566 side!

**Comment by rfuchs** [comment]
That would be the answer then. Where'the log from the answer?

**Comment by D4rk4** [comment]
I'm sorry. What you mean in "log from the answer"?

**Comment by rfuchs** [comment]
The INVITE from your A (containing Opus) would be the `offer` you see in the logs. You posted it above. It gets rewritten to PCMU.

The response from B (200 OK) that should contain PCMU would be the `answer`. It needs to go through rtpengine so that it can rewrite it back to Opus. You haven't posted the for for this `answer` yet.

**Comment by D4rk4** [comment]
Here is dump of SIP traffic between Proxy and side B. I guess you mean it.
```
17:25:36.981066 IP 192.168.4.3.5060 > 192.168.4.1.5060: SIP: INVITE sip:1101@192.168.4.3:5060 SIP/2.0
..p....O^.....E..Q4L..@................=..INVITE sip:1101@192.168.4.3:5060 SIP/2.0
Record-Route: <sip:192.168.4.3;lr;ftag=iRmqhb.NCou2HMqoe6k8PoRUACflXUA6>
Via: SIP/2.0/UDP 192.168.4.3;branch=z9hG4bK02ba.53fd4dff881a07a5deaeb0f926e10a38.0
Via: SIP/2.0/UDP 192.168.4.3:5566;received=192.168.4.3;rport=5566;branch=z9hG4bKPj3JQQHwjHzkEit1Q.PJpodk3rOTlzJck9
Max-Forwards: 69
From: sip:Telegram;tag=iRmqhb.NCou2HMqoe6k8PoRUACflXUA6
To: sip:1101@192.168.4.3
Contact: <sip:192.168.4.3:5566;ob>
Call-ID: M0pFrDFWWxiOaxNzbLNvD7G3GNmV6FqR
CSeq: 18154 INVITE
Allow: PRACK, INVITE, ACK, BYE, CANCEL, UPDATE, INFO, SUBSCRIBE, NOTIFY, REFER, MESSAGE, OPTIONS
Supported: replaces, 100rel, norefersub
X-GW-Context: 15160-215
Content-Type: application/sdp
Content-Length:   241

v=0
o=- 3772794336 3772794336 IN IP4 192.168.4.3
s=pjmedia
b=AS:117
t=0 0
a=X-nat:0
m=audio 30024 RTP/AVP 0
c=IN IP4 192.168.4.3
b=TIAS:96000
a=ssrc:2102448287 cname:580ec141316f86a4
a=rtpmap:0 PCMU/8000
a=sendrecv
a=rtcp:30025

17:25:36.988813 IP 192.168.4.1.5060 > 192.168.4.3.5060: SIP: SIP/2.0 100 Trying
.O^.....p.....Eh.........d...............OSIP/2.0 100 Trying
Via: SIP/2.0/UDP 192.168.4.3;branch=z9hG4bK02ba.53fd4dff881a07a5deaeb0f926e10a38.0,SIP/2.0/UDP 192.168.4.3:5566;received=192.168.4.3;rport=5566;branch=z9hG4bKPj3JQQHwjHzkEit1Q.PJpodk3rOTlzJck9
From: sip:Telegram;tag=iRmqhb.NCou2HMqoe6k8PoRUACflXUA6
To: sip:1101@192.168.4.3
Date: Mon, 22 Jul 2019 14:25:36 GMT
Call-ID: M0pFrDFWWxiOaxNzbLNvD7G3GNmV6FqR
CSeq: 18154 INVITE
Allow-Events: telephone-event
Server: Cisco-SIPGateway/IOS-15.2.4.M11
Content-Length: 0


17:25:37.868293 IP 192.168.4.1.5060 > 192.168.4.3.5060: SIP: SIP/2.0 180 Ringing
.O^.....p.....Eh.a.....................M..SIP/2.0 180 Ringing
Via: SIP/2.0/UDP 192.168.4.3;branch=z9hG4bK02ba.53fd4dff881a07a5deaeb0f926e10a38.0,SIP/2.0/UDP 192.168.4.3:5566;received=192.168.4.3;rport=5566;branch=z9hG4bKPj3JQQHwjHzkEit1Q.PJpodk3rOTlzJck9
From: sip:Telegram;tag=iRmqhb.NCou2HMqoe6k8PoRUACflXUA6
To: sip:1101@192.168.4.3;tag=217A5078-1C9
Date: Mon, 22 Jul 2019 14:25:36 GMT
Call-ID: M0pFrDFWWxiOaxNzbLNvD7G3GNmV6FqR
CSeq: 18154 INVITE
Require: 100rel
RSeq: 1021
Allow: INVITE, OPTIONS, BYE, CANCEL, ACK, PRACK, UPDATE, REFER, SUBSCRIBE, NOTIFY, INFO, REGISTER
Allow-Events: telephone-event
Remote-Party-ID: "Dmitry G." <sip:1101@192.168.4.1>;party=called;screen=yes;privacy=off
Contact: <sip:1101@192.168.4.1:5060>
Record-Route: <sip:192.168.4.3;lr;ftag=iRmqhb.NCou2HMqoe6k8PoRUACflXUA6>
Server: Cisco-SIPGateway/IOS-15.2.4.M11
Content-Length: 0


17:25:37.882355 IP 192.168.4.3.5060 > 192.168.4.1.5060: SIP: PRACK sip:1101@192.168.4.1:5060 SIP/2.0
..p....O^.....E...4...@..................BPRACK sip:1101@192.168.4.1:5060 SIP/2.0
Via: SIP/2.0/UDP 192.168.4.3;branch=z9hG4bK12ba.4b352f4fcf0d7f0803c6d2707cda8577.0
Via: SIP/2.0/UDP 192.168.4.3:5566;received=192.168.4.3;rport=5566;branch=z9hG4bKPjHIFlTGDsL..4eyFZuhl666SVrOxOaNKr
Max-Forwards: 69
From: sip:Telegram;tag=iRmqhb.NCou2HMqoe6k8PoRUACflXUA6
To: sip:1101@192.168.4.3;tag=217A5078-1C9
Call-ID: M0pFrDFWWxiOaxNzbLNvD7G3GNmV6FqR
CSeq: 18155 PRACK
RAck: 1021 18154 INVITE
Content-Length:  0


17:25:37.884289 IP 192.168.4.1.5060 > 192.168.4.3.5060: SIP: SIP/2.0 200 OK
.O^.....p.....Eh.........t................SIP/2.0 200 OK
Via: SIP/2.0/UDP 192.168.4.3;branch=z9hG4bK12ba.4b352f4fcf0d7f0803c6d2707cda8577.0,SIP/2.0/UDP 192.168.4.3:5566;received=192.168.4.3;rport=5566;branch=z9hG4bKPjHIFlTGDsL..4eyFZuhl666SVrOxOaNKr
From: sip:Telegram;tag=iRmqhb.NCou2HMqoe6k8PoRUACflXUA6
To: sip:1101@192.168.4.3;tag=217A5078-1C9
Date: Mon, 22 Jul 2019 14:25:37 GMT
Call-ID: M0pFrDFWWxiOaxNzbLNvD7G3GNmV6FqR
Server: Cisco-SIPGateway/IOS-15.2.4.M11
CSeq: 18155 PRACK
Content-Length: 0


17:25:40.454503 IP 192.168.4.1.5060 > 192.168.4.3.5060: SIP: SIP/2.0 200 OK
.O^.....p.....Eh.{.....................g..SIP/2.0 200 OK
Via: SIP/2.0/UDP 192.168.4.3;branch=z9hG4bK02ba.53fd4dff881a07a5deaeb0f926e10a38.0,SIP/2.0/UDP 192.168.4.3:5566;received=192.168.4.3;rport=5566;branch=z9hG4bKPj3JQQHwjHzkEit1Q.PJpodk3rOTlzJck9
From: sip:Telegram;tag=iRmqhb.NCou2HMqoe6k8PoRUACflXUA6
To: sip:1101@192.168.4.3;tag=217A5078-1C9
Date: Mon, 22 Jul 2019 14:25:37 GMT
Call-ID: M0pFrDFWWxiOaxNzbLNvD7G3GNmV6FqR
CSeq: 18154 INVITE
Allow: INVITE, OPTIONS, BYE, CANCEL, ACK, PRACK, UPDATE, REFER, SUBSCRIBE, NOTIFY, INFO, REGISTER
Allow-Events: telephone-event
Remote-Party-ID: <sip:1101@192.168.4.1>;party=called;screen=yes;privacy=off
Contact: <sip:1101@192.168.4.1:5060>
Record-Route: <sip:192.168.4.3;lr;ftag=iRmqhb.NCou2HMqoe6k8PoRUACflXUA6>
Supported: replaces
Supported: sdp-anat
Server: Cisco-SIPGateway/IOS-15.2.4.M11
Supported: timer
Content-Type: application/sdp
Content-Disposition: session;handling=required
Content-Length: 187

v=0
o=CiscoSystemsSIP-GW-UserAgent 737 2048 IN IP4 192.168.4.1
s=SIP Call
c=IN IP4 192.168.4.1
t=0 0
m=audio 16914 RTP/AVP 0
c=IN IP4 192.168.4.1
a=rtpmap:0 PCMU/8000
a=ptime:20

17:25:40.458651 IP 192.168.4.3.5060 > 192.168.4.1.5060: SIP: ACK sip:1101@192.168.4.1:5060 SIP/2.0
..p....O^.....E...5...@..................%ACK sip:1101@192.168.4.1:5060 SIP/2.0
Via: SIP/2.0/UDP 192.168.4.3;branch=z9hG4bK02ba.d6ba7cfc0e7aeebc9138017ca3ed35fd.0
Via: SIP/2.0/UDP 192.168.4.3:5566;received=192.168.4.3;rport=5566;branch=z9hG4bKPj2tkulERuZf51ce4OTi5wfXOwfOsfvWtm
Max-Forwards: 69
From: sip:Telegram;tag=iRmqhb.NCou2HMqoe6k8PoRUACflXUA6
To: sip:1101@192.168.4.3;tag=217A5078-1C9
Call-ID: M0pFrDFWWxiOaxNzbLNvD7G3GNmV6FqR
CSeq: 18154 ACK
Content-Length:  0


17:25:40.458671 IP 192.168.4.3.5060 > 192.168.4.1.5060: SIP: BYE sip:1101@192.168.4.1:5060 SIP/2.0
..p....O^.....E...5...@..................%BYE sip:1101@192.168.4.1:5060 SIP/2.0
Via: SIP/2.0/UDP 192.168.4.3;branch=z9hG4bKe1ba.c64547df03a98ed695893f3b4fb4d98d.0
Via: SIP/2.0/UDP 192.168.4.3:5566;received=192.168.4.3;rport=5566;branch=z9hG4bKPjFrLx5AMcjQZv.ECQdIWsgK9yPieAUIl4
Max-Forwards: 69
From: sip:Telegram;tag=iRmqhb.NCou2HMqoe6k8PoRUACflXUA6
To: sip:1101@192.168.4.3;tag=217A5078-1C9
Call-ID: M0pFrDFWWxiOaxNzbLNvD7G3GNmV6FqR
CSeq: 18156 BYE
Content-Length:  0


17:25:40.464785 IP 192.168.4.1.5060 > 192.168.4.3.5060: SIP: SIP/2.0 200 OK
.O^.....p.....Eh.>.......'.............*./SIP/2.0 200 OK
Via: SIP/2.0/UDP 192.168.4.3;branch=z9hG4bKe1ba.c64547df03a98ed695893f3b4fb4d98d.0,SIP/2.0/UDP 192.168.4.3:5566;received=192.168.4.3;rport=5566;branch=z9hG4bKPjFrLx5AMcjQZv.ECQdIWsgK9yPieAUIl4
From: sip:Telegram;tag=iRmqhb.NCou2HMqoe6k8PoRUACflXUA6
To: sip:1101@192.168.4.3;tag=217A5078-1C9
Date: Mon, 22 Jul 2019 14:25:40 GMT
Call-ID: M0pFrDFWWxiOaxNzbLNvD7G3GNmV6FqR
Server: Cisco-SIPGateway/IOS-15.2.4.M11
CSeq: 18156 BYE
Reason: Q.850;cause=16
P-RTP-Stat: PS=0,OS=0,PR=0,OR=0,PL=0,JI=0,LA=0,DU=0
Content-Length: 0
```

**Comment by rfuchs** [comment]
No I don't mean the SIP traffic, I mean the rtpengine log for the `answer`. In the SIP dump, there's a "200 OK" SIP message with SDP. Your Kamailio script should invoke rtpengine when that message comes through, and it would show up as an `answer` in the logs.

**Comment by rfuchs** [comment]
If rtpengine doesn't actually get invoked from the 200 OK, then there's a problem in your Kamailio config.

**Comment by D4rk4** [comment]
No any answers:
```
root@helper:~# journalctl -xu kamailio | grep -i answer
root@helper:~# journalctl -xu ngcp-rtpengine-daemon.service | grep -i answer
```

Okay, what can be wrong with this config? I'm try diffirent variants, and spend all weekend for it =) But always get this problem with rtpengine handling. Any suggestions?

**Comment by rfuchs** [comment]
Can't answer that. Add some debugging log messages to the config? Could be a problem in your routing too.

**Comment by D4rk4** [comment]
Look like this is the issue:
```
Dec 21 20:39:26 tg-transcoder rtpengine[19823]: INFO: [JMAYCFhIyYk7vlYpPet96fwXZ9oxx1Mv]: Received command 'offer' from 127.0.0.1:57639
Dec 21 20:39:26 tg-transcoder rtpengine[19823]: NOTICE: [JMAYCFhIyYk7vlYpPet96fwXZ9oxx1Mv]: Creating new call
Dec 21 20:39:26 tg-transcoder rtpengine[19823]: INFO: [JMAYCFhIyYk7vlYpPet96fwXZ9oxx1Mv]: Not transcoding PCM DTMF tones to telephone-event packets as no payload type with a matching clock rate for 'opus/48000/2' was found
```
May you suggest, how fix this?

**Comment by D4rk4** [comment]
> You should probably add `telephone-event/48000` to your transcoded media list. Or you can upgrade to a new rtpengine version which handles this automatically.

```
Feb 28 17:23:34 tg-transcoder rtpengine[506]: INFO: [82AB19E7-792011EB-B5F2CECC-5145A3E6@192.168.11.1]: Received command 'answer' from 127.0.0.1:41351
Feb 28 17:23:34 tg-transcoder rtpengine[506]: WARNING: [82AB19E7-792011EB-B5F2CECC-5145A3E6@192.168.11.1]: Unknown flag encountered: 'telephone-event/48000'
Feb 28 17:23:34 tg-transcoder rtpengine[506]: WARNING: [82AB19E7-792011EB-B5F2CECC-5145A3E6@192.168.11.1]: Protocol error in packet from 127.0.0.1:41351: Unknown call-id [d3:sdp348:v=0
```
