### ISSUE TITLE
Rtpengine does not send RTP package to proper port behind NAT when doing play media without callee

### ISSUE THREAD

**Issue by truong-hua** [sipwise/rtpengine#1526]
I tried this suggestion https://github.com/OpenSIPS/opensips/issues/1996#issuecomment-644200253 to be able to play an early media when some one call to a fixed number. It's working well in local network but if the caller is behind NAT, play media does not learn the proper public port but it sent to the original media port in the INVITE message.

This is the INVITE message from caller

```
INVITE sip:welcome.wav@x.x.x.209 SIP/2.0
Via: SIP/2.0/TCP 192.168.0.105:13536;branch=z9hG4bK-524287-1---5c703c4c1833b664;rport
Max-Forwards: 70
Contact: <sip:tester@42.113.114.25:21421;ob>;+sip.instance="<urn:uuid:DE4C5E6E-7C47-390D-5838-C5890F9C2402>"
To: <sip:welcome.wav@x.x.x.209>
From: <sip:tester@x.x.x.209>;tag=9ef9891a
Call-ID: qXyS9DsRDZVU4JQEo9u0sA..
CSeq: 1 INVITE
Allow: INVITE, ACK, CANCEL, OPTIONS, BYE, REFER, NOTIFY, MESSAGE, REGISTER, SUBSCRIBE, INFO, PUBLISH
Content-Type: application/sdp
Supported: replaces, answermode, eventlist, outbound, path
User-Agent: PortSIP Softphone Win - v16.0.46
Allow-Events: hold, talk, conference, dialog
Content-Length: 338

v=0
o=- 420237831 1 IN IP4 42.113.114.25
s=ps
c=IN IP4 42.113.114.25
t=0 0
m=audio 20012 RTP/AVP 105 8 0 18 101
a=rtpmap:105 opus/48000/2
a=fmtp:105 useinbandfec=1
a=rtpmap:8 PCMA/8000
a=rtpmap:0 PCMU/8000
a=rtpmap:18 G729/8000
a=fmtp:18 annexb=yes
a=rtpmap:101 telephone-event/8000
a=fmtp:101 0-16
a=mid:audio
a=sendrecv
```

The IP `42.113.114.25` is already client public IP (may be the software does this detection), the port 20012 of course is their private port.

This is the 183 message generated from OpenSIPS:
```
D¥iÞÐk¦E`*@5¯«ôÑÀ¨iÄËÐ^TôôÛûPõÿSIP/2.0 183 Session Progress
Via: SIP/2.0/TCP 192.168.0.105:13536;received=42.113.114.25;branch=z9hG4bK-524287-1---5c703c4c1833b664;rport=63751
To: <sip:welcome.wav@171.244.18.209>;tag=00c4-9a17565fea9464abfeb8585bad279c20
From: <sip:tester@171.244.18.209>;tag=9ef9891a
Call-ID: qXyS9DsRDZVU4JQEo9u0sA..
CSeq: 1 INVITE
Content-Type: application/sdp
Server: OpenSIPS (3.2.7 (x86_64/linux))
Content-Length: 350

v=0
o=- 420237831 1 IN IP4 x.x.x.5
s=ps
c=IN IP4 x.x.x.5
t=0 0
m=audio 30080 RTP/AVP 105 8 0 18 101
a=mid:audio
a=rtpmap:105 opus/48000/2
a=fmtp:105 useinbandfec=1
a=rtpmap:8 PCMA/8000
a=rtpmap:0 PCMU/8000
a=rtpmap:18 G729/8000
a=fmtp:18 annexb=yes
a=rtpmap:101 telephone-event/8000
a=fmtp:101 0-16
a=sendrecv
a=rtcp:30081
```

The `x.x.x.5` is public IP of rtpengine and `30080` is public port. Rtpengine does not run behind NAT.

I tried tcpdump on rtpengine server and see that rtpengine did `play media` but it send to the port `20012` instead of `33776` which is the public port. (20012 is translated to `vboxd` below).
```
16:08:45.320770 IP 171.244.20.5.30016 > 42.113.114.25.vboxd: UDP, length 57
16:08:45.320831 IP 171.244.20.5.30017 > 42.113.114.25.20013: UDP, length 52
16:08:45.323131 IP 171.244.20.5.30016 > 42.113.114.25.vboxd: UDP, length 78
16:08:45.336538 IP 42.113.114.25.33776 > 171.244.20.5.30081: UDP, length 47
16:08:45.343086 IP 171.244.20.5.30016 > 42.113.114.25.vboxd: UDP, length 78
16:08:45.355859 IP 42.113.114.25.33776 > 171.244.20.5.30081: UDP, length 47
16:08:45.363154 IP 171.244.20.5.30016 > 42.113.114.25.vboxd: UDP, length 73
16:08:45.366636 IP 42.113.114.25.33776 > 171.244.20.5.30081: UDP, length 47
16:08:45.383134 IP 171.244.20.5.30016 > 42.113.114.25.vboxd: UDP, length 72
16:08:45.394404 IP 42.113.114.25.33776 > 171.244.20.5.30081: UDP, length 47
16:08:45.403194 IP 171.244.20.5.30016 > 42.113.114.25.vboxd: UDP, length 71
16:08:45.415877 IP 42.113.114.25.33776 > 171.244.20.5.30081: UDP, length 47
16:08:45.423092 IP 171.244.20.5.30016 > 42.113.114.25.vboxd: UDP, length 70
16:08:45.436568 IP 42.113.114.25.33776 > 171.244.20.5.30081: UDP, length 47
16:08:45.443139 IP 171.244.20.5.30016 > 42.113.114.25.vboxd: UDP, length 76
16:08:45.454796 IP 42.113.114.25.33776 > 171.244.20.5.30081: UDP, length 47
16:08:45.463143 IP 171.244.20.5.30016 > 42.113.114.25.vboxd: UDP, length 67
```

I think that rtpengine will try to learn or detect the proper public port? Isn't it? I tried to add these flags to `offer` command but there is no luck `RTP/AVP replace-session-connection replace-origin ICE=remove media-handover NAT-wait`.

My `rtpengine` is working properly with both caller and callee join into the call. The problem above is I'm trying to play a media without any callee to answer the invitation.

Is it a rtpengine but or am I doing something wrong?

**Comment by rfuchs** [comment]
From your pcap it looks like the NAT'd machine sends packets from their NAT port 33776 to your rtpengine's port 30081 only, and nothing to 30080. Is that correct? 30081 would be the RTCP port. So based on what you posted, rtpengine has not received anything to its RTP port and so had no way of learning the correct remote port for RTP.

**Comment by truong-hua** [comment]
Yup, I tried a non NAT environment and it's working fine. I think this
should be rtpengine problem. So fix me if I'm wrong.

**Comment by rfuchs** [comment]
Your RTP client or your network is sending packets to the wrong port. How is this rtpengine's problem?
